{
  "schema_version": "ao.forge.goal-run-retained-evidence.v0.1",
  "goal_id": "ao2-weekend-hardening",
  "iteration": "20260619T180000Z-verification",
  "phase": "verification",
  "summary": "Retained AO Foundry RSI improvement gate proving the pulse loop measured a 10 percent local improvement against the 5 percent threshold without repository mutation.",
  "captured_outputs": [
    {
      "label": "ao-foundry-rsi-improvement-gate",
      "command": "foundry pulse run",
      "schema_version": "ao.foundry.rsi-improvement-gate.v0.1",
      "status": "passed",
      "baseline_score": 90,
      "candidate_score": 100,
      "required_improvement_percent": 5,
      "actual_improvement_percent": 10,
      "autonomous_claim": "measured_local_improvement",
      "mutates_repositories": false
    }
  ],
  "retention_policy": {
    "layout": "docs/evidence/goals/<goal_id>/<YYYYMMDDTHHMMSSZ>-<phase>/",
    "temporary_paths_allowed": false,
    "minimum_retention_days_after_terminal_phase": 90
  },
  "retention_metadata": {
    "retained_at": "2026-06-19T18:00:00Z",
    "retention_class": "loop_evidence",
    "retain_while_goal_active": true,
    "deletion_requires_review": true,
    "cleanup_change_must_name": [
      "goal_id",
      "iteration",
      "reason"
    ]
  }
}
