{
  "schema_version": "ao.forge.goal-run-retained-evidence.v0.1",
  "goal_id": "ao2-weekend-hardening",
  "iteration": "20260101T020000Z-complete",
  "phase": "complete",
  "summary": "Retained public promotion provenance fixture proving production promotion evidence remains mandatory retention after the terminal cleanup window.",
  "retention_policy": {
    "layout": "docs/evidence/goals/<goal_id>/<YYYYMMDDTHHMMSSZ>-<phase>/",
    "temporary_paths_allowed": false,
    "minimum_retention_days_after_terminal_phase": 90
  },
  "retention_metadata": {
    "retained_at": "2026-01-01T02:00:00Z",
    "retention_class": "promotion_provenance",
    "retain_while_goal_active": true,
    "deletion_requires_review": true,
    "cleanup_change_must_name": ["goal_id", "iteration", "reason"]
  }
}
